{
  "audio_idx": 0,
  "audio_name": "hi_00000",
  "whisper_hyp": "तुमारे पास तीन महिने बच्छे हैं",
  "mms_1b_hyp": "तुम्हारे पास तीन महीने बच्चे हैं",
  "mms_zs_constrained_hyp": "मरे बस दिन महीने बचे हम",
  "omni_hyp": "तुम्हारे पास तीन महीने बच्चे है",
  "ref_dev": "तुम्हारे पास तीन महीने बचे हैं।",
  "llm_decision": {
    "raw": "LANGUAGE: Hindi\nTRANSCRIPTION: तुम्हारे पास तीन महीने बच्चे हैं\nCONFIDENCE: high\nREASONING: Whisper's transcription \"तुमारे पास तीन महिने बच्छे हैं\" has a small spelling error with \"महिने\" instead of \"महीने\". MMS-1B's transcription \"तुम्हारे पास तीन महीने बच्चे हैं\" is more accurate and grammatically correct. MMS-ZeroShot-Constrained's transcription \"मरे बस दिन महीने बचे हम\" is significantly different and less likely to be correct. OmniASR's transcription \"तुम्हारे पास तीन महीने बच्चे है\" has a small error with the verb conjugation. Therefore, I have selected MMS-1B's transcription as the most accurate.",
    "language": "Hindi",
    "transcription": "तुम्हारे पास तीन महीने बच्चे हैं",
    "confidence": "high",
    "reasoning": "Whisper's transcription \"तुमारे पास तीन महिने बच्छे हैं\" has a small spelling error with \"महिने\" instead of \"महीने\". MMS-1B's transcription \"तुम्हारे पास तीन महीने बच्चे हैं\" is more accurate and grammatically correct. MMS-ZeroShot-Constrained's transcription \"मरे बस दिन महीने बचे हम\" is significantly different and less likely to be correct. OmniASR's transcription \"तुम्हारे पास तीन महीने बच्चे है\" has a small error with the verb conjugation. Therefore, I have selected MMS-1B's transcription as the most accurate."
  },
  "wer": 0.3333333333333333,
  "cer": 0.0967741935483871
}